{
	"schemaVersion": 1,
	"stage": "stage-10a-api-contract",
	"capturedAt": "2026-08-07T07:59:03.217Z",
	"run": {
		"id": "stage10a-20260807t075841z-0a58ad0b",
		"logRoot": "evidence/stage-10a-api-contract-run"
	},
	"source": {
		"baseSha": "f92960e51c3dc3056bbf2c89b860d5f6f5c672b4",
		"implementationSha": "0a58ad0be9f67d783be3ba16092c8290fc41127c",
		"treeClean": true,
		"declaredMode": "skeleton",
		"typescriptCatalogPin": "5.9.3"
	},
	"host": {
		"os": "darwin",
		"architecture": "arm64",
		"kernel": "25.5.0",
		"insideDevcontainer": false,
		"bunVersion": "1.3.13",
		"gitVersion": "2.50.1",
		"ghVersion": "2.59.0"
	},
	"repository": {
		"nameWithOwner": "MrChrisRodriguez/devenv",
		"workflowFile": ".github/workflows/ci.yml",
		"gateJobId": "ci-gate",
		"gateContext": "CI gate",
		"gateNeeds": [
			"ci",
			"image",
			"affected",
			"project",
			"moon-graph",
			"browser"
		],
		"formsGuardScript": "forms:check",
		"ciGuardScript": "ci:check",
		"registryFile": "api-contract.json",
		"capability": "rhf_zod",
		"addedJobs": 0
	},
	"commands": [
		{
			"id": "forms-guard",
			"command": ["bun", "run", "forms:check"],
			"runId": "stage10a-20260807t075841z-0a58ad0b",
			"startedAt": "2026-08-07T07:58:41.781Z",
			"completedAt": "2026-08-07T07:58:42.310Z",
			"durationMs": 529,
			"stdoutPath": "evidence/stage-10a-api-contract-run/forms-guard.stdout",
			"stderrPath": "evidence/stage-10a-api-contract-run/forms-guard.stderr",
			"stdoutSha256": "397d29f012de06ca3b0ebe53d46640ea35fd6ab1a8572c7c1954b84167536d17",
			"stderrSha256": "05d09b08d25ef90dda742452a9f2a7e61407e4fb0d58045ec090c31fa44b7d74",
			"exitCode": 0,
			"status": "pass"
		},
		{
			"id": "ci-guard",
			"command": ["bun", "run", "ci:check"],
			"runId": "stage10a-20260807t075841z-0a58ad0b",
			"startedAt": "2026-08-07T07:58:42.310Z",
			"completedAt": "2026-08-07T07:58:42.370Z",
			"durationMs": 60,
			"stdoutPath": "evidence/stage-10a-api-contract-run/ci-guard.stdout",
			"stderrPath": "evidence/stage-10a-api-contract-run/ci-guard.stderr",
			"stdoutSha256": "9cfe650e97435463f535e1a81f5b30b1ab521cfb458af04688f901be57a294f9",
			"stderrSha256": "d183538a63c244d8ba196aa5a8eb1eb4cfc636414a9ba546e4cfb9b3537e4088",
			"exitCode": 0,
			"status": "pass"
		},
		{
			"id": "forms-mutations",
			"command": ["bun", "test", "scripts/template/__tests__/forms.test.ts"],
			"runId": "stage10a-20260807t075841z-0a58ad0b",
			"startedAt": "2026-08-07T07:58:42.370Z",
			"completedAt": "2026-08-07T07:58:51.779Z",
			"durationMs": 9409,
			"stdoutPath": "evidence/stage-10a-api-contract-run/forms-mutations.stdout",
			"stderrPath": "evidence/stage-10a-api-contract-run/forms-mutations.stderr",
			"stdoutSha256": "ca35b94f2c5b623fccbd1cc9e77eef3e30a6fcf4b045842fc1353f7ae6d8ea32",
			"stderrSha256": "4bd8f0346e04b268083e81368e251ce0e0a2986fef0354a96b454fe4bd98ddbd",
			"exitCode": 0,
			"status": "pass"
		},
		{
			"id": "browser-safety-matrix",
			"command": [
				"bun",
				"test",
				"scripts/template/__tests__/forms.test.ts",
				"-t",
				"browser safe"
			],
			"runId": "stage10a-20260807t075841z-0a58ad0b",
			"startedAt": "2026-08-07T07:58:51.779Z",
			"completedAt": "2026-08-07T07:58:52.513Z",
			"durationMs": 734,
			"stdoutPath": "evidence/stage-10a-api-contract-run/browser-safety-matrix.stdout",
			"stderrPath": "evidence/stage-10a-api-contract-run/browser-safety-matrix.stderr",
			"stdoutSha256": "ca35b94f2c5b623fccbd1cc9e77eef3e30a6fcf4b045842fc1353f7ae6d8ea32",
			"stderrSha256": "eb7a8fda2273d13223be87976f735c0bfb3e57a7fe7a703169469f941a2ea6bb",
			"exitCode": 0,
			"status": "pass"
		},
		{
			"id": "drift-gate",
			"command": [
				"bun",
				"test",
				"scripts/template/__tests__/forms.test.ts",
				"-t",
				"generated artifacts that drift"
			],
			"runId": "stage10a-20260807t075841z-0a58ad0b",
			"startedAt": "2026-08-07T07:58:52.513Z",
			"completedAt": "2026-08-07T07:58:53.819Z",
			"durationMs": 1306,
			"stdoutPath": "evidence/stage-10a-api-contract-run/drift-gate.stdout",
			"stderrPath": "evidence/stage-10a-api-contract-run/drift-gate.stderr",
			"stdoutSha256": "ca35b94f2c5b623fccbd1cc9e77eef3e30a6fcf4b045842fc1353f7ae6d8ea32",
			"stderrSha256": "be0f1e850812247535c5fb3321546e854529234ab0b14bcdb41e0ec5fb7c7cb8",
			"exitCode": 0,
			"status": "pass"
		},
		{
			"id": "evolution-gate",
			"command": [
				"bun",
				"test",
				"scripts/template/__tests__/forms.test.ts",
				"-t",
				"contract evolution that is not additive"
			],
			"runId": "stage10a-20260807t075841z-0a58ad0b",
			"startedAt": "2026-08-07T07:58:53.820Z",
			"completedAt": "2026-08-07T07:58:54.134Z",
			"durationMs": 314,
			"stdoutPath": "evidence/stage-10a-api-contract-run/evolution-gate.stdout",
			"stderrPath": "evidence/stage-10a-api-contract-run/evolution-gate.stderr",
			"stdoutSha256": "ca35b94f2c5b623fccbd1cc9e77eef3e30a6fcf4b045842fc1353f7ae6d8ea32",
			"stderrSha256": "ddd11201fdab5d1a0e61c9e9eaff6603fd71329de67911f8ab9e421a9e653227",
			"exitCode": 0,
			"status": "pass"
		},
		{
			"id": "parallel-types",
			"command": [
				"bun",
				"test",
				"scripts/template/__tests__/forms.test.ts",
				"-t",
				"second set of response types"
			],
			"runId": "stage10a-20260807t075841z-0a58ad0b",
			"startedAt": "2026-08-07T07:58:54.134Z",
			"completedAt": "2026-08-07T07:58:55.546Z",
			"durationMs": 1412,
			"stdoutPath": "evidence/stage-10a-api-contract-run/parallel-types.stdout",
			"stderrPath": "evidence/stage-10a-api-contract-run/parallel-types.stderr",
			"stdoutSha256": "ca35b94f2c5b623fccbd1cc9e77eef3e30a6fcf4b045842fc1353f7ae6d8ea32",
			"stderrSha256": "520196c4b76e2e42552bb6968c803cd1a24679f93b876cfab1b5fb4df9ca98a1",
			"exitCode": 0,
			"status": "pass"
		},
		{
			"id": "authz-seam",
			"command": [
				"bun",
				"test",
				"scripts/template/__tests__/forms.test.ts",
				"-t",
				"inline authorization outside the declared policy seam"
			],
			"runId": "stage10a-20260807t075841z-0a58ad0b",
			"startedAt": "2026-08-07T07:58:55.546Z",
			"completedAt": "2026-08-07T07:58:56.360Z",
			"durationMs": 814,
			"stdoutPath": "evidence/stage-10a-api-contract-run/authz-seam.stdout",
			"stderrPath": "evidence/stage-10a-api-contract-run/authz-seam.stderr",
			"stdoutSha256": "ca35b94f2c5b623fccbd1cc9e77eef3e30a6fcf4b045842fc1353f7ae6d8ea32",
			"stderrSha256": "12b973bb094a59888c06017a4ac1082b0eb803520f7d07c984274dd0deb8f59d",
			"exitCode": 0,
			"status": "pass"
		},
		{
			"id": "form-bindings",
			"command": [
				"bun",
				"test",
				"scripts/template/__tests__/forms.test.ts",
				"-t",
				"registers every form"
			],
			"runId": "stage10a-20260807t075841z-0a58ad0b",
			"startedAt": "2026-08-07T07:58:56.360Z",
			"completedAt": "2026-08-07T07:58:56.975Z",
			"durationMs": 615,
			"stdoutPath": "evidence/stage-10a-api-contract-run/form-bindings.stdout",
			"stderrPath": "evidence/stage-10a-api-contract-run/form-bindings.stderr",
			"stdoutSha256": "ca35b94f2c5b623fccbd1cc9e77eef3e30a6fcf4b045842fc1353f7ae6d8ea32",
			"stderrSha256": "7340b041d5d9f315409bdc18ed3c8f6aae0621e31a5a5ffeb51cf7d52c1d2251",
			"exitCode": 0,
			"status": "pass"
		},
		{
			"id": "rendered-forms",
			"command": [
				"bun",
				"scripts/template/collect-stage-ten-a-evidence.ts",
				"probe-render-forms",
				"--workspace",
				"/tmp/devenv-stage10a-20260807t075841z-0a58ad0b-render"
			],
			"runId": "stage10a-20260807t075841z-0a58ad0b",
			"startedAt": "2026-08-07T07:58:56.976Z",
			"completedAt": "2026-08-07T07:58:57.771Z",
			"durationMs": 795,
			"stdoutPath": "evidence/stage-10a-api-contract-run/rendered-forms.stdout",
			"stderrPath": "evidence/stage-10a-api-contract-run/rendered-forms.stderr",
			"stdoutSha256": "677668b1f25482366f8a4d97df6b3ece3e0c1776eb76ebaf85d7356d998ffac0",
			"stderrSha256": "e3b0c44298fc1c149afbf4c8996fb92427ae41e4649b934ca495991b7852b855",
			"exitCode": 0,
			"status": "pass"
		},
		{
			"id": "live-gate",
			"command": [
				"bash",
				"-c",
				"set -euo pipefail\nrun=\"$(gh run view 31159545163 --repo MrChrisRodriguez/devenv --json conclusion,createdAt,databaseId,event,headBranch,headSha,jobs,status,url,workflowName)\"\nprintf 'runJson=%s\\n' \"$(printf '%s' \"$run\" | python3 -c 'import json,sys; print(json.dumps(json.load(sys.stdin), sort_keys=True, separators=(\",\", \":\")))')\"\ngate=\"$(printf '%s' \"$run\" | python3 -c 'import json,sys; jobs=[job[\"databaseId\"] for job in json.load(sys.stdin)[\"jobs\"] if job[\"name\"] == sys.argv[1]]; print(jobs[0] if jobs else \"\")' \"CI gate\")\"\nprintf 'gateJobId=%s\\n' \"$gate\"\nlog=\"$(gh run view --repo MrChrisRodriguez/devenv --job \"$gate\" --log)\"\nprintf 'gateLogSha256=%s\\n' \"$(printf '%s' \"$log\" | shasum -a 256 | awk '{ print $1 }')\"\nprintf 'upstreamResults=%s\\n' \"$(printf '%s\\n' \"$log\" | sed -n 's/.*upstream results: //p' | head -n 1)\"\nprintf 'gateGreenLines=%s\\n' \"$(printf '%s\\n' \"$log\" | grep -c 'Every required job passed or was skipped' || true)\""
			],
			"runId": "stage10a-20260807t075841z-0a58ad0b",
			"startedAt": "2026-08-07T07:58:57.771Z",
			"completedAt": "2026-08-07T07:59:02.639Z",
			"durationMs": 4868,
			"stdoutPath": "evidence/stage-10a-api-contract-run/live-gate.stdout",
			"stderrPath": "evidence/stage-10a-api-contract-run/live-gate.stderr",
			"stdoutSha256": "da13ff120bb204f0c81cfea71ec9263a261fe24c9d9356a7719371d3eb2bf7d1",
			"stderrSha256": "e3b0c44298fc1c149afbf4c8996fb92427ae41e4649b934ca495991b7852b855",
			"exitCode": 0,
			"status": "pass"
		},
		{
			"id": "rollback-proof",
			"command": [
				"bun",
				"scripts/template/collect-stage-ten-a-evidence.ts",
				"probe-rollback",
				"--base",
				"f92960e51c3dc3056bbf2c89b860d5f6f5c672b4",
				"--implementation",
				"0a58ad0be9f67d783be3ba16092c8290fc41127c",
				"--workspace",
				"/tmp/devenv-stage2-stage10a-20260807t075841z-0a58ad0b-rollback"
			],
			"runId": "stage10a-20260807t075841z-0a58ad0b",
			"startedAt": "2026-08-07T07:59:02.639Z",
			"completedAt": "2026-08-07T07:59:03.217Z",